车型名称,车型ID,页码,评论序号,点评车型,提车时间,购买地点,裸车价格,油耗,续航,评论内容,评分_综合,评分_外观,评分_内饰,评分_配置,评分_空间,评分_续航能耗,评分_驾驶感受,评分_辅助驾驶,评分_智能座舱
理想MEGA怎么样_理想MEGA值得买吗,6067,1,1,2025款理想MEGA Ultra 智能焕新版,2025-07,南阳,52.98万,,500.00km,外观科技帅气，到哪里都吸引目光很拉风，空间大，舒适，开着也很惬意，动力充沛，续航扎实，自营5C充电快,4.65,4.5,5,5,5,5,5,,
理想MEGA怎么样_理想MEGA值得买吗,6067,1,2,2025款理想MEGA Home 家庭特别版,2026-03,深圳,54.98万,,350.00km,外观无可挑剔 ，作为理想one车主，内饰中控屏立起来看起来还是没有 理想one内嵌的漂亮，空间综合来说够用 配置该有的都有，如果有预算建议直接上高配，旋转座椅几乎不用，但是得有，车身太大，没有后轮转向，窄道行驶极其困难，车库小的需谨慎，续航很不满意，销售讲 500~600，高速智驾 120，也就是350~400，一直开理想 (5 年支持 90w算上改装 100)辅助驾驶综合来说还算可以，有些小细节需要完善 智能座舱很不错,3.38,5,4,3,4,1,2,,
理想MEGA怎么样_理想MEGA值得买吗,6067,1,3,2025款理想MEGA Home 家庭特别版,2026-04,上海,53.00万,,450.00km,非常好，喜欢这个车很久了，老婆同意拿下了，很开心，孩子们也很喜欢，超级奶爸车！家有两位小公主！,5,5,5,5,5,5,5,,
理想MEGA怎么样_理想MEGA值得买吗,6067,1,4,2025款理想MEGA Home 家庭特别版,2025-06,北京,55.00万,,500.00km,"新车提车第N天驾驶体验分享
车型：理想Mega Home
颜色：灰外-棕内饰
车到了两周，上完牌开始补提车日记了，交车的时候，100%⚡️续航570km左右（和标的700km还是有差距的），续航折扣比例提前车友群里问了问，大概夏天八折冬天五-六折这个样子；
来说一说使用感受：
提速：虽然是一台mpv，不过各种提速不带虚的，电车提速就是快，比我之前的c快了很多，稍稍一踩就过去了；
智驾：目前使用智驾开了有将近100km了（开之前还要先学习课程），总体来看在高速道路正常行驶没问题，但是面对岔路口情况，还是不够智能，体现在识别不够精准（个人感觉，走那种高速三岔口会判断不好），所以建议高速上行驶时候可以使用，但是上下高速或市区道路，还是不建议；
泊车：可以说非常激进了，比我自己停车还狠，而且速度很快，坦白说，我觉得它自己泊车停的不管是速度还是位置，都很激进。。。
操控：个人认为很灵敏，全程开下来，底盘的质感和空悬的反馈还不错，方向调整很轻，基本上指哪打哪，响应都很即时。
座舱：这就不用多赘述了，感觉现在市面上能打的不多，绝对没问题；
语音控制：对我来说算是亮点了，识别准确度很高；
目前就这么多，欢迎各位交流；",4.67,5,5,5,5,3,5,,
理想MEGA怎么样_理想MEGA值得买吗,6067,1,5,2025款理想MEGA Home 家庭特别版,2025-07,上海,55.48万,,575.00km,"外观设计十分前卫，车体巨大，内部空间尤其第三排表现优异。

内饰设计强调家用舒适性，用材有环保认证，但看起来设计和豪华感略欠缺，新车气味表现中规中矩，需要散味一段时间，用甲醛仪器测得空气质量介于优良之间。

一排驾驶位自适应坐垫软硬带通风按摩，副驾驶女王座椅，二排一键零重力，三排电动角度调节带加热，且视窗巨大，基本做到三排平权。后排支持亲子房模式及大客厅模式，行驶中180°转向单座不影响驾驶及乘坐，比较实用。

动力感受较强但不激烈，百公里加速5秒多，但对于3.4吨的庞然大物表现已经可圈可点。

双腔单阀空悬对于路面过滤表现较好，也有人认为路感不清或有开船的感觉，但个人感觉驾驶和乘坐还是比较舒适的，同时车辆NVH控制非常好，安静所以容易超速。

离车泊入和自动泊车非常好用，理想同学对于指令的理解和反应速度很快，可以批量执行语言命令，整体使用感受较好。

车辆可以通过任务大师自行编制命令实现多种定制用途，互动性和智能型较好。

续航和智驾尚未实测，待行驶一段时间后再评。",4.75,5,4,5,5,4,5,,
理想MEGA怎么样_理想MEGA值得买吗,6067,1,6,2025款理想MEGA Home 家庭特别版,2025-07,杭州,55.98万,,600.00km,家庭用车吧，实际续航估计500左右，总体感觉还行，功能还是比较多的，得研究一段时间,4.92,5,5,5,5,4.5,5,,
理想MEGA怎么样_理想MEGA值得买吗,6067,1,7,2025款理想MEGA Home 家庭特别版,2025-11,泰安,55.98万,,710.00km,车子非常好开，很适合家用，车机强大。就是城市智驾有点欠妥。闯过红灯，实线变过道，还需要改进，高速智驾没问题。,5,5,5,5,5,5,5,,
理想MEGA怎么样_理想MEGA值得买吗,6067,1,8,2025款理想MEGA Home 家庭特别版,2026-02,北京,55.98万,,450.00km,"外观设计因人而异，个人感觉外观很漂亮！
优点:
真安静！百万级别车的安静！
车内空间感觉够用了，但你要说空间有多富裕，个人感觉刚好够用！7座正常的话。后备箱空间一般！
行驶感觉还行，很好开。
智驾的话不做太多评价，感觉它开没我自己开效率高！用过两次，很紧张，市区我觉得意义不大，高速以后再做测试！
车辆续航感觉能开450左右。冬天这个续航还凑合，够用。高速还没跑过，一般短途高速出行400公里也够用了，没有太大焦虑。
现阶段家里需要一个7座mpv，感觉mega综合起来更适合家用，安静，舒适，有乐趣，每个座位都能照顾到足以！",4.83,5,5,5,5,4,5,,
理想MEGA怎么样_理想MEGA值得买吗,6067,1,9,2025款理想MEGA Home 家庭特别版,2025-07,北京,56.48万,,450.00km,外观仁者见仁，智者见智。外观我给满分，空间满分 动力满分 续航稍弱一点  辅助驾驶还不能做到百分百放心,4.88,5,5,5,5,4.5,5,,
理想MEGA怎么样_理想MEGA值得买吗,6067,1,10,2025款理想MEGA Home 家庭特别版,2025-08,深圳,55.98万,,550.00km,空间够大，功能都有，底盘扎实，悬架舒服，就转弯麻烦点，车身太长，转弯时候要注意刮蹭,5,5,5,5,5,5,5,,
理想MEGA怎么样_理想MEGA值得买吗,6067,1,11,2025款理想MEGA Home 家庭特别版,2025-08,绵阳,56.98万,,480.00km,"先说缺点
1价格贵了一点
2没有后轮专项，56以上的车了这配不了
3开车雷达精准度360环视让我有点抓不准距离感觉上有一点盲区。
4没有电动窗帘差评到底都56以上的车了这配不了么。
 优点
满足了家庭绝大部分场景的需求吧适合2胎的家庭",4.5,5,5,4,5,4,4,,
理想MEGA怎么样_理想MEGA值得买吗,6067,1,12,2025款理想MEGA Home 家庭特别版,2025-09,石家庄,56.00万,,420.00km,"对比过X9， GL8插混、岚图梦想家、极氪009。
外形和家庭定位让我选择了这个mega。
有待提高：
1. 底盘有点低，提车3000km了 刮了两次了
2.座椅线束杂乱、座椅轨道润滑油抹的很业余；
3.底盘调教一般、如果不开运动，有点晕。
4.实际续航380-450 
5.智能驾驶也就那样，市区下班时间最好还是不好用。好几次差点撞到人

比较喜欢的点：
1. 理想同学能跟孩子对话，替我讲故事
2.小冰箱很实用
3. 智能驾驶高速还是比较省心",3.92,4.5,5,3,5,3,3,,
理想MEGA怎么样_理想MEGA值得买吗,6067,1,13,2025款理想MEGA Home 家庭特别版,2025-08,宁波,54.78万,,420.00km,对比过其他热门 MPV，GL8/D9/赛那/009，前三者主要还是外观老气，尤其是 D9，驾驶乘坐都差一点，软的让人晕，赛那的头部空间以及座舱的塑料感真的没法忍，009主要还是空间问题，驾乘品质算是最好吧，Mega 这次加入旋转座椅以后空间变化就很多，尤其出去露营的时候，用了半个月，主要问题是缺少后轮转向，虽然转弯半径相比车身长度来说并不差，但缺少一把掉头的信心，另外尾门没有一脚踢也是差强人意，不知道为什么会缺少这个配置，想不明白，其次显示驱动能耗也是理想鸡贼的一面，其实这么大一个车平均能耗也就22/23也算是比较优秀了，不明白为什么就不可以老老实实的标出来，马上要出差临沂，来回大概会有1500公里路程，可以测一下长途的体验了,4.63,5,4.5,4.5,5,4.5,4,,
理想MEGA怎么样_理想MEGA值得买吗,6067,1,14,2025款理想MEGA Home 家庭特别版,2025-10,沈阳,55.98万,,524.00km,"沈阳理想mega新车一千公里，提车14天，充电预热异响，充电启动联电异响，沈阳售后不给解决方案，直说给换件，一个六十万的新车就这么处理吗？理想的质量，理想的售后都哪去了。这以后MeGa的车主不是在逃生的路上就是在去维修维权的路上。沈阳北二路售后一会说水泵坏了，一会说什么电磁吸合器坏了，最后更搞笑的找一辆事故车和我车对比，竟然事故车一点问题没有，我的新车却是各种异响，简直是啪啪打脸！！！！！！！！！！！！！！！！！！！！！！！！！！！！！！！！！！！！！！！！！！！！！！！！！！！！！！！！！！！！！！！！！！！！！！！！！！！！！！！！！！！！！！！！！！！！！！
尤其北方的车主，千万要注意了，全国的车主快去检查一下吧！",0.94,1,1,1,1,1,1,,
理想MEGA怎么样_理想MEGA值得买吗,6067,1,15,2025款理想MEGA Home 家庭特别版,,,,,,这是一辆非常棒的家庭用车，除了停车比较麻烦，其他基本上没有毛病，当然和fsd比起来还是没有到那个啊，最顶级的水平，但是家庭用车来说，对女主人是非常友好的,5,5,5,5,5,5,5,,
理想MEGA怎么样_理想MEGA值得买吗,6067,1,16,,,,,,,"2天喜提极氪009，开启舒适出行新篇章！

头天看车，第二天提车还有谁！

从看到它的第一眼，就被这独特的外观吸引。车身线条硬朗大气，前脸造型辨识度超高，开在路上回头率满满。

优点：1.车内空间超宽敞，二排简直是“头等舱”待遇。座椅的电动调节、加热通风按摩功能一应俱全，坐上去就不想下来。

2.动力强劲，电门一踩，推背感说来就来。操控也很稳，底盘扎实，过弯并线都很轻松。智能配置更是让驾驶乐趣倍增，大屏幕车机系统超好用。
缺点：1.续航还是无法让我有十足的安全感，冬日重庆续航只能到550左右。 
2.智驾还是略显智障。高速NZP还好，就是偶尔莫名其妙，期待下一次的更新吧。
这一个月的体验下来，极氪 009 真的没让我失望。无论是日常通勤还是家庭出游，它都能完美胜任。期待之后和它一起走过更多的路，解锁更多美好瞬间。
改了黑武士的009就一个字：帅！",,,,,,,,,
理想MEGA怎么样_理想MEGA值得买吗,6067,2,1,2025款理想MEGA Home 家庭特别版,,,,,,行驶质感，车内体验，各各方面都非常不错，也有缺点：刹车稍微偏软，冬天续航打折（每个电车都是）,4.94,5,5,5,4.5,5,5,,
理想MEGA怎么样_理想MEGA值得买吗,6067,2,2,2025款理想MEGA Home 家庭特别版,,,,,,整体比较满意，要是硬说缺点就是续航稍微能再增加一百公里就好了，目前高速 130 巡航续航冬季 420km，春季 450，但是到了 10% 心里就有点慌，如果能再增加 100 到 150 公里续航就完美了，,4.81,5,5,5,5,4,4.5,,
理想MEGA怎么样_理想MEGA值得买吗,6067,2,3,2024款理想MEGA Ultra版,2024-12,佛山,52.00万,,480.00km,"外观，仁者见仁，智者见智，对于我来说，喜欢就买，考虑别人的眼光和评价会让你的人生寸步难行，因为没有十全十美的东西，也没有所有人都能接受的事物，只不过是网络上有自我认知的人太少了而已，都在跟风，所以为什么说控制一个人最低的成本就是舆论，现实中很多人见了我的车都会上前友好交流，问问我价格已经空间各方面，同时也在夸赞国产新能源越来越出色等词语，估计那些黑子在现实中也就只敢躲在角落偷偷贬低吧，哈哈哈哈，
开过A8.E300.X5M,我只能说，想让自己的生活更加轻松愉悦，下班回家路上不想在继续劳累的开车，你可以考虑新能源，在车上你不用再去为了打开一个东西翻来覆去的去找那个按键，堵车的时候可以打开noa自己躺在座椅上享受一下按摩，（当然，我说的不止是理想汽车，其他新能源做的也很好）语音控制就行了，更不用说舒适度了，虽然mega确实底盘偏软，但不妨碍我喜欢。
还有一堆人说的什么节假日充电焦虑，如果你没钱或者是个抠搜的人，我建议你买轩逸和卡罗拉，嗯油耗很低，不用续航焦虑，如果你是觉得生活中这些小开销无所谓，只要自己的身心愉悦等等，5c超充最优解，这里并不是觉得蔚来的换电不行，他们的技术更快捷，但是5c相比于其他充电桩  你可以理解有个单独为你设立的充电桩，而且满打满算一台车也就20分钟，所以，续航和充电焦虑，我不担心，
空间什么的我就不说了，真的想买的人，不需要靠别人去说，而是自己去试，我这篇文章发出来只是想告诉大家，多低头反思反思自我，别沉迷在网络上被舆论操控成一枚棋子，",4.5,5,5,,5,3.5,,3.5,5
理想MEGA怎么样_理想MEGA值得买吗,6067,2,4,2024款理想MEGA Ultra版,2024-08,哈尔滨,52.98万,,450.00km,"曾经是宝马忠诚用户，有过4台宝马，现在在开着的有一台6gt，一台2系。每次买车也都是在bba里面选择，但是一直都喜欢宝马的驾驶感受，所以每次买车最终都选择了宝马。

本来我对国产车，特别新势力新能源车，是没有什么好印象的，因为固有思维的缘故，认为传统车企都有百年造车底蕴，而新势力造车才几年，根本比不了。而这次购车的起因有三点：一、在网上评价了别人的理想抬显不清晰，所以被很多人喷了，都让我去看实车。二、我大哥给孩子买了一个l6，说比他7系还好开。三、刷到新款009视频，本来想买009的，认为有沃尔沃的技术加持，能靠谱些。

我们城市是没有极氪4s店的，我也以为没有理想4s店呢，所以就去了有极氪4s点的哈西红场，想着买之前把竞品都看看，免得后悔。所以先去看了理想。去了之后有点被样子和空间惊艳到了，但内心还是认为是样子货，所以没试驾就走了，看了009，觉得空间不满意，6坐没过道，7坐没小桌板，座椅坐垫没按摩，抬显看着有点迷糊，智驾没有理想好（但是当时对智驾一点概念都没有，觉得鸡肋，有没有都行）。后来试驾，驾驶质感还是挺惊艳的，觉得比我6gt还要好，但感觉有点刹不住车，风噪抑制的很好，但是胎噪很大。本来我都想订了，但是老婆非要回理想也试驾下，回到理想一试驾，结果感觉更好，舒适模式底盘有点像美系车，老婆喜欢那种感觉，运动模式底盘就像宝马了，来的干脆。风噪胎噪基本没有，这点我太满意了，真没想到做了几年的车企能把这做成这样！也体验了智驾，但当时觉得没有用，结果回来之后用习惯了天天用，真的很实用，特别是离车泊入，现在停车基本都用这个，但用这个功能有点矛盾，如果人不在那看着吧，怕撞车。人在那看着吧，那还不如自己倒了。好的点还是很多的，音响，智能化，就不一一说了，自己去试下就知道了。

再说下服务，整个所有服务流程，从售前贷款在到交付，充电桩安装，整个流程近乎完美的体验。只发生了一点小插曲。

售前：我原来的宝马销售，现在在哈西红场理想店呢，所以我去就是找他，结果第一遍到店他出去试驾了，但是其他销售也非常热心的帮我介绍，但是我没好意思，就谢绝了。第二遍去店里他老婆要生孩子，所以下班走了，而他另一个同事在我明确告知要找我认识的人买的情况下依然非常耐心的给我介绍，并且带我去试驾。我要对哈尔滨红场店的所有服务人员好评，团队团结有凝聚力，这是让我相信理想品牌的很重要原因，团队的价值观很重要。而极氪的销售就很不专业，在知道我要买mega的情况下说这车是棺材车啥的。让我对极氪品牌大失所望。销售素质一言难尽。
贷款：因为我是异地购车，需要签贷款合同，我说那我去一趟吧，销售说不用，我们和贷款专员过去。这种待遇是在bba没有的。对了，可以免抵押贷款50万。
保险：全险5200，这你敢信吗？我是不信的，因为我6gt第一年保险16000。在4s店上的，现在5年了也没低于6000。mega公司户，6gt个人户，这会差点，但是也差太多了。说明理想直销模式把保险返点全部让利给了用户。
交付：大庆交付的。交付落下一个水杯架没给，后要的，现在还没收到。交付当天上午问他们车到没到，他们说没到，下午快4点告诉我能交了，整完快7点了。贴膜时候碰到当天一起交车的l6车主，说上午他交车就看到我这个车停那了。可能我这个是异地交付的原因吧，服务和效率和本地会有差异。
充电桩安装：整个流程保姆式服务，不需要你操心一点，安装过程每一步都得给总部拍照，能把事情做到这么极致，一定要点赞的。
小插曲：哈尔滨看车回来还有再去看下车，所以去了大庆4s店，和他们销售说在哈尔滨看过车了，也准备在哈尔滨买，就来看看，结果销售引导我试驾，把我的客户关系绑定到他身上，后来订车差点算他业绩，我听说给我气坏了。我买车想找谁买还做不了主吗？我要是没告诉你也行，明确告诉你还要套路我，最终关系又绑定回哈尔滨了。
5c充电桩：买纯电车的主要原因是这个，解决了我的里程焦虑，从大庆去大连，全程冲2-3次电就行了，都有5c充电桩，我记得公主岭服务区有，海城下高速不远也有，速度嘎嘎快，20分钟充满，基本厕所没上完电充满了。

不满意的：后备箱没有一脚踢！家庭用车怎么可以没有这个，太不方便了。没有后轮转向，这么长的车最好有一个，但是看在车这个舒服的情况下我接受了。

总结：车是真好，服务真好！全家都满意且不后悔的车。这车刚出我就喜欢这个样子，但是固有思维的原因，迟迟没有去看，但是我不固执，以后还是要提升自己对新事物的认知。想买这车的别在意网上黑子们说的，黑子无非三种人：买不起的，没体验过的，固执的。好多说这车贵的，那是你跟啥比，我觉得这车性价比挺高。他开着不比宝马次，我为啥不能拿他和宝马比，本来我想年底买x7，但三年得赔50万还是让我犹豫，这车就不一样了，满足我对车所有要求。最后祝所有mega车主升官！发财！哈哈，我们自己说，省的他们说",4.79,5,4.5,4.5,5,4.5,5,,
理想MEGA怎么样_理想MEGA值得买吗,6067,2,5,2024款理想MEGA Ultra版,2024-03,杭州,55.98万,,560.00km,"外观：外观部分因人而异吧，我就是喜欢这个造型才买的车，很有未来范有科技感。
内饰：乘坐的体验很舒适，理想的彩电大沙发算是玩明白了，包裹性很强，很柔软，缺点是内饰缺少氛围感，有点过于平淡，这个无线充电面板充电功率是够的，但是手机太烫了，卡的掉帧，前排没有电吸门是最大的遗憾，太不优雅了。
空间：空间也是我选择的一大因素，很好的照顾了所有乘客，空间表现很满意。
续航：wltc表显570km，我杭州提车，中途去了金华，最后回温州，实表470km，还剩60km，表现还算满意的，驱动电耗17左右
智驾：我以前开过小鹏和蔚来，对我来说，mega的智驾真的算好用了，比蔚来强，和小鹏差不多
驾驶感受：软，特别软，但是我喜欢，哈哈
总结：我买这个车还是属于冲动型的，因为我喜欢这个外观，为他买的单。个人觉得车价还是偏高，车子是很不错的，整体来讲，家人还是满意，有考虑入手的同学，不急的可以等波降价。",4.43,5,4,4,5,4.5,4,,
理想MEGA怎么样_理想MEGA值得买吗,6067,2,6,2024款理想MEGA Ultra版,2024-03,北京,55.98万,,550.00km,"我这MEGA已经开了5000km了，说实话，是真的舒服！比我这22款L9舒服太多了，一个是座椅，一个是悬挂。我发了提车视频后，XHS和B站一些人说，不可能有人买了L9还要买MEGA，其实这就相当于iPhone 14 pro换到15 Pro，你说它是翻天覆地改变么？并不是，但是手感、C口、就这两点对于很多人就是购买的理由了。当然你说买iPhone不爱国的话，我拿出我的加价版mate 60 pro+、小米 Ultra、以及mate Pad不知道算不算爱国？

MEGA吃亏的地方在于，它的外观虽然很个性，但是内饰以及配置并没有特别能直接让人不开就说好的地方，尤其作为L系列车主，这个内饰实在没有太多的惊喜，但很多地方都要真的去开和用才能体会，就比如这底盘“舒服”，就是一个键盘值极低的点，没有赛道圈速支撑，没有百公里加速量化，仅靠屁股和体感是无法说服很多人的，但是只要试过就能体会这种“舒服”的魅力。而且这底盘的好，我觉得真的超过了我对它最开始的期待。这种超预期的感觉，我最近开过的车，一个是24款的极氪001，一个就是MEGA，极氪001新款的空悬可以用同价位无敌来形容。而我现在真的也更喜欢开MEGA而不是L9了，除了开在街上确实够吸引眼球，另一方面，就是它更好的舒适性和质感。

另外，关于舆论这事，我这一周一直在观察和了解，你开这车在路上，很多人会从旁边摇下车窗拍照，在停车场，会有人过来问和了解，它甚至已经形成了一个符号。相比较网上的黑子，现实中更多人是知道这车，想了解，我也和几个过来看车的人很直白的问，他们的反馈更多是帅，而不是像。我至今没有推荐过任何人买这车，也没有在网上推荐任何人购买，这车真的不是一款所谓的性价比产品，对于很多人都觉得这车价格高，但是如果你不开一段，不坐一段，你肯定是不会明白这价格高在哪里？但对我来说，喜欢的东西又何必管别人的眼光啊？",4.36,4.5,4,4,4,4,5,,
理想MEGA怎么样_理想MEGA值得买吗,6067,2,7,2024款理想MEGA Ultra版,2024-10,西安,52.78万,,400.00km,二排座椅还是很舒服的，特别适合带孩子，所以是奶爸车，智驾不太行，第三排也很舒适，续航里程有点短，容易续航焦虑。5c充电桩也有点少。,4.08,5,5,,5,2.5,,3,4
理想MEGA怎么样_理想MEGA值得买吗,6067,2,8,2024款理想MEGA Ultra版,2024-03,金华,55.98万,,550.00km,"从浙江金华驾车到深圳接上朋友去广西 重庆 然后又出发去广东珠海，等着这个月4月15号广州广交会！我也是理想L8 一年的车主、自从开上理想、我的奔驰G500 还有路虎发现4 都不想碰了 ！ 还是电车舒服、辅助驾驶太香了，开长途自驾出游太安逸！
外观方面MEGA的设计十分个性，该车的设计追求极致简洁，也是我作为理想老车主、我只喜欢我喜欢的！其它内饰其实也就是L系列差不多！
唯一不足就是等理想的5C 车充尽快落实 ，布满大街小巷！任重而道远啊 ！",4.86,5,5,5,5,4,5,,
理想MEGA怎么样_理想MEGA值得买吗,6067,2,9,2024款理想MEGA Ultra版,2024-11,上海,53.98万,,550.00km,外观非常好看，在我的审美上！而且续航比我想象的纯电车高很多，用起来没有充电焦虑。除了第三排不是完整的三个座位、后排电视小了点外，其他内部基本都能满足我的需求。,4.33,5,4.5,,4,5,,3.5,4
理想MEGA怎么样_理想MEGA值得买吗,6067,2,10,2024款理想MEGA Ultra版,,,,,,都还行，外观比较超前，功能多 乘坐驾驶都比较舒服，基本上都能满足,4.83,5,5,5,5,4,5,,
